{
  "$schema": "http://json-schema.org/draft-07/schema#",
  "$id": "attribute",
  "type": "object",
  "required": ["id", "name", "icon", "description", "color", "min", "max", "defaultValue", "group"],
  "additionalProperties": false,
  "properties": {
    "id": { "type": "string" },
    "name": { "type": "string" },
    "icon": { "type": "string" },
    "description": { "type": "string" },
    "color": { "type": "string" },
    "min": { "type": "integer" },
    "max": { "type": "integer" },
    "defaultValue": { "type": "integer" },
    "group": { "type": "string" },
    "hidden": { "type": "boolean" }
  }
}
